{
  "run_id": "20260327_joint-budget-mvp",
  "generated_at": "2026-03-28T06:43:21",
  "files": [
    {
      "path": "stdout.log",
      "size_bytes": 0,
      "sha256": "e3b0c44298fc1c149afbf4c8996fb92427ae41e4649b934ca495991b7852b855"
    },
    {
      "path": "stderr.log",
      "size_bytes": 0,
      "sha256": "e3b0c44298fc1c149afbf4c8996fb92427ae41e4649b934ca495991b7852b855"
    },
    {
      "path": "metrics.json",
      "size_bytes": 206,
      "sha256": "cee56d4793418ea2ef7f709cda3b3f570bf67a9f47326b7d9fc9a68ad698742b"
    },
    {
      "path": "expected_vs_actual.md",
      "size_bytes": 62,
      "sha256": "0c48527cd87613e23806981583285005be1357b274fd5bf128c233205ac3c5b4"
    }
  ],
  "missing": []
}
